<?xml version="1.0" encoding="UTF-8"?>
<!DOCTYPE dota SYSTEM "dota.dtd">
<dota>
    <game>
        <name> Defense of the Ancients ( Дота )</name>
        <genre> Multiplayer online battle arena ( или бойна арена с повече от един играча ) </genre>
        <designer> "Ice Frog" </designer>
    </game>
    <buildings>
        <building side="sentinel" main="Tree of Life">
            <region> средата </region>
            <type> кула </type>
            <life> 1000</life>
            <defence> 2 </defence>
            <damage> 40 </damage>
        </building>
        <building side="scorge" main="Tree of Life">
            <region> средата </region>
            <type> кула </type>
            <life> 1200</life>
            <defence> 3 </defence>
            <damage> 60 </damage>
        </building>
        <building side="scorge" main="Acolyte">
            <region> горен ръкав </region>
            <type> казарма </type>
            <life> 2300 </life>
            <defence> 3.5 </defence>
            <damage> няма </damage>
        </building>
    </buildings>
    
    <heroes>
        <hero id="Tuskarr" attack="melee" affiliation="sentinel">
            <title> Ymir </title> 
            <atribute short="STR"> сила </atribute>
            <status> регенерация </status>
            <movespeed> Скорост на движение: 305 </movespeed>
            <skills>
                <skill>
                    <num1> Ice Shards   </num1>
                    <num2> Snowball   </num2>
                    <num3> Frozen Sigil  </num3>
                    <num4> Walrus Punch  </num4>
                </skill>
            </skills>
            <armor> броня: 3.22 </armor>
            <dps> щета: 50 - 54 </dps>
        </hero>  
        <hero id="Axe" attack="melee" affiliation="scorge">
            <title> Mogul Khan </title> 
            <atribute short="STR"> сила </atribute>
            <status> няма </status>
            <movespeed> Скорост на движение: 290 </movespeed>
            <skills>
                <skill>
                    <num1> Berserker's Call   </num1>
                    <num2> Battle Hunger   </num2>
                    <num3> Counter Helix  </num3>
                    <num4> Culling Blade  </num4>
                </skill>
            </skills>
            <armor> броня: 1.8 </armor>
            <dps> щета: 49 - 53 </dps>
        </hero>  
        <hero id="Crixalis" attack="melee" affiliation="scorge">
            <title> Sand King </title> 
            <atribute short="AGI"> ловкост  </atribute>
            <status> илюзии </status>
            <movespeed> Скорост на движение: 300 </movespeed>
            <skills>
                <skill>
                    <num1> Burrowstrike   </num1>
                    <num2> Sand Storm </num2>
                    <num3> Caustic Finale   </num3>
                    <num4> Epicenter   </num4>
                </skill>
            </skills>
            <armor> броня: 2.66 </armor>
            <dps> щета: 43 - 59 </dps>
        </hero>  
    </heroes>
    
    <items>
        <item id="Satanic " slot="2" hero="Tuskarr">
            <merchant> Enchanted Artifacts </merchant>
            <price> 6150 </price>
            <effects> 
                <effect>
                    <main> 25 сила, 20 щета, 5 броня </main>
                    <secondary>Крадене на живот (пасивно), Нечовшка ярост (активно) </secondary>
                </effect>
            </effects>
            <need> Секира (3200) , Каска на доминацията (1850)  </need>
            <description> Мощно оръжие, казва се , че са били притежавани от самите Drak'thul. </description>
        </item>
        <item id="Bracer" slot="6" hero="Crixalis">
            <merchant> Gateway Relics </merchant>
            <price> 525 </price>
            <effects> 
                <effect>
                    <main> 6 сила  </main>
                    <secondary> 3 щета </secondary>
                </effect>
            </effects>
            <need> корона на благородството (185), рицърска ръкавица на силата (150)   </need>
            <description> Украсена гривна за китката. </description>
        </item>
    </items>
    
</dota>

