<?xml version="1.0" encoding="utf-8"?>
<!DOCTYPE dota SYSTEM "dota.dtd">
<dota>
  <game>
    <name>dwqdqw</name>
    <genre>dqwdqw</genre>
    <designer>dqwdwq</designer>
  </game>
  <buildings>
    <building side="scorge" main="main">
      <region>region</region>
      <type>building</type>
      <life>1</life>
      <defence>123</defence>
      <damage>1</damage>
    </building>
    <building side="scorge" main="main">
      <region>region</region>
      <type>building</type>
      <life>1</life>
      <defence>123</defence>
      <damage>1</damage>
    </building>
  </buildings>
  <heroes>
    <hero attack="melee" affiliation="scorge">
      <title>titole</title>
      <atribute short="AGI" />
      <status>status</status>
      <movespeed>123</movespeed>
      <skills />
      <armor>kur</armor>
      <dps>123</dps>
    </hero>
    <hero attack="melee" affiliation="scorge">
      <title>titole</title>
      <atribute short="AGI" />
      <status>status</status>
      <movespeed>123</movespeed>
      <skills />
      <armor>kur</armor>
      <dps>123</dps>
    </hero>
  </heroes>
  <items>
    <item slot="0" hero="kur">
      <merchant>qk</merchant>
      <price>123</price>
      <effects>
        <effect>
          <main>dobre</main>
          <secondary>qko da</secondary>
        </effect>
        <effect>
          <main>dobre</main>
          <secondary>qko da</secondary>
        </effect>
      </effects>
      <need>tes</need>
      <description>da</description>
    </item>
    <item slot="0" hero="kur">
      <merchant>qk</merchant>
      <price>123</price>
      <effects>
        <effect>
          <main>dobre</main>
          <secondary>qko da</secondary>
        </effect>
        <effect>
          <main>dobre</main>
          <secondary>qko da</secondary>
        </effect>
      </effects>
      <need>tes</need>
      <description>da</description>
    </item>
  </items>
</dota>