<?xml version="1.0" encoding="UTF-8"?>
<!DOCTYPE dota SYSTEM "dota.dtd">
<dota>
    
    <game>
        <name> Defense of the Ancients ( Дота )</name>
        <genre> Multiplayer online battle arena ( или бойна арена с повече от един играча ) </genre>
        <designer> "Ice Frog" </designer>
    </game>
    
    <buildings>
        <building side="scorge" main="Acolyte" >
            <region> долен ръкав </region>
            <type> казарма </type>
            <life> 2000 </life>
            <defence> 3 </defence>
            <damage> няма </damage>
        </building>
        <building side="sentinel" main="Tree of Life">
            <region> горен ръкав </region>
            <type> казарма </type>
            <life> 2500 </life>
            <defence> 3 </defence>
            <damage> няма </damage>
        </building>
    </buildings>
    
    <heroes>
        <hero id="Phoenix" attack="range" affiliation="sentinel">
            <title> Icarus </title> 
            <atribute short="STR"> сила </atribute>
            <status> двойна щета  </status>
            <movespeed> Скорост на движение: 285 </movespeed>
            <skills>
                <skill>
                    <num1> Icarus Dive  </num1>
                    <num2> Fire Spirits  </num2>
                    <num3> Sun Ray  </num3>
                    <num4> Supernova  </num4>
                </skill>
            </skills>
            <armor> броня: -0.32 </armor>
            <dps> щета: 43-53 </dps>
        </hero>  
        <hero id="Spiritbreaker" attack="melee" affiliation="scorge">
            <title> Barathrum </title> 
            <atribute short="STR"> сила </atribute>
            <status> няма </status>
            <movespeed> Скорост на движение: 290 </movespeed>
            <skills>
                <skill>
                    <num1> Charge of Darkness  </num1>
                    <num2> Empowering бързане  </num2>
                    <num3> Greater Bash  </num3>
                    <num4> Nether Strike  </num4>
                </skill>
            </skills>
            <armor> броня: 5.38 </armor>
            <dps> щета: 60-70 </dps>
        </hero>  
        <hero id="Undying" attack="melee" affiliation="scorge">
            <title> Dirge </title> 
            <atribute short="STR"> сила </atribute>
            <status> няма </status>
            <movespeed> Скорост на движение: 310 </movespeed>
            <skills>
                <skill>
                    <num1> Decay  </num1>
                    <num2> Soul Rip  </num2>
                    <num3> Tombstone  </num3>
                    <num4> Flesh Golem  </num4>
                </skill>
            </skills>
            <armor> броня: 3.4 </armor>
            <dps> щета: 57 - 65 </dps>
        </hero>  
        <hero id="Butcher" attack="melee" affiliation="scorge">
            <title> Pudge </title> 
            <atribute short="STR"> сила </atribute>
            <status> няма  </status>
            <movespeed> Скорост на движение: 285 </movespeed>
            <skills>
                <skill>
                    <num1> Meat Hook  </num1>
                    <num2> Rot  </num2>
                    <num3> Flesh Heap  </num3>
                    <num4> Flesh Heap  </num4>
                </skill>
            </skills>
            <armor> броня: 0.96 </armor>
            <dps> щета: 52 - 58 </dps>
        </hero>  
    </heroes>
    
    <items>
        <item id="Mask of Madness" slot="1" hero="Butcher">
            <merchant> Enchanted Artifacts </merchant>
            <price> 1900 </price>
            <effects> 
                <effect>
                    <main> Крадене на живот (пасивно) </main>
                    <secondary> Берзерк (активно) </secondary>
                </effect>
            </effects>
            <need> Маска на смъртта (900) </need>
            <description> Тази маска изглежда толкова странно, че ви тласка към лудост. </description>
        </item>
        <item id="Blade Mail" slot="2" hero="Undying">
            <merchant> Protectorate </merchant>
            <price> 2200 </price>
            <effects> 
                <effect>
                    <main> 22 щета, 6 броня </main>
                    <secondary> връща щета (активно) </secondary>
                </effect>
            </effects>
            <need> Меч (1200), Броня (550), Наметало на магиосник  (450)  </need>
            <description> Изключително точна броня, изобретен от Пламтящия легион </description>
        </item>
    </items>
    
</dota>



