<?xml version="1.0" encoding="utf-8"?>
<!DOCTYPE dota SYSTEM "dota.dtd">
<dota>
  <game>
    <name>dwqdqw</name>
    <genre>dqwdqw</genre>
    <designer>dqwdwq</designer>
  </game>
  <buildings>
    <building side="scorge" main="main">
      <region>region</region>
      <type>type</type>
      <life>100</life>
      <defence>123</defence>
      <damage>100</damage>
    </building>
    <building side="scorge" main="main">
      <region>region</region>
      <type>type</type>
      <life>100</life>
      <defence>123</defence>
      <damage>100</damage>
    </building>
  </buildings>
  <heroes>
    <hero id="EarthDick" attack="melee" affiliation="scorge">
      <title>wqq</title>
      <atribute short="AGI" />
      <status>21</status>
      <movespeed>2</movespeed>
      <skills>
        <skill>
          <num1>ewq</num1>
          <num2>dqwdqw</num2>
          <num3>dqwdqw</num3>
          <num4>dwqdqq</num4>
        </skill>
      </skills>
      <armor>wqwq</armor>
      <dps>12</dps>
    </hero>
    <hero id="misho" attack="melee" affiliation="scorge">
      <title>wqq</title>
      <atribute short="AGI" />
      <status>21</status>
      <movespeed>2</movespeed>
      <skills>
        <skill>
          <num1>ewq</num1>
          <num2>dqwdqw</num2>
          <num3>dqwdqw</num3>
          <num4>dwqdqq</num4>
        </skill>
      </skills>
      <armor>wqwq</armor>
      <dps>12</dps>
    </hero>
  </heroes>
  <items>
    <item id="0" slot="1" hero="EarthDick">
      <merchant>merchant</merchant>
      <price>12</price>
      <effects>
        <effect>
          <main>dobre</main>
          <secondary>qko da</secondary>
        </effect>
        <effect>
          <main>dobre</main>
          <secondary>qko da</secondary>
        </effect>
      </effects>
      <need>tes</need>
      <description>description</description>
    </item>
    <item id="0" slot="1" hero="EarthDick">
      <merchant>merchant</merchant>
      <price>12</price>
      <effects>
        <effect>
          <main>dobre</main>
          <secondary>qko da</secondary>
        </effect>
        <effect>
          <main>dobre</main>
          <secondary>qko da</secondary>
        </effect>
      </effects>
      <need>tes</need>
      <description>description</description>
    </item>
  </items>
</dota>